{
  "schema_version": "0.1.0",
  "registry_id": "dad-offerings-registry",
  "authority_boundary": "This richer DAD card catalog advertises assets, skills, templates, harnesses, architecture references, maps, and known upgrades as candidate offerings. Target repos decide local adoption.",
  "offerings": [
    {
      "offering_id": "dad:offering:ai-engineering-preflight",
      "name": "AI Engineering Preflight",
      "version": "0.1.0",
      "offering_type": "asset",
      "path": "assets/ai-engineering-preflight",
      "languages": ["python", "rust", "mixed", "agent-instruction"],
      "repo_types": ["application", "library", "control_plane", "template_repo"],
      "domains": ["software_engineering", "ai_engineering"],
      "context_tags": ["coding_asset", "preflight", "validation", "governance"],
      "task_types": ["coding", "refactor", "testing", "agent_instruction_design", "repo_template_creation"],
      "capabilities": ["preflight_profile", "rust_guidance", "python_guidance", "downstream_rollout"],
      "applies_when": ["An AI agent is about to perform material software work."],
      "does_not_apply_when": ["The task is a read-only lookup or the target repo has not approved DAD pointers."],
      "public_safe": true,
      "upgrade_channel": "dad_mail",
      "known_upgrades": [],
      "source_refs": ["assets/asset-registry.json", "registry/coding-asset-registry.json"],
      "review_status": "installed_for_local_reuse",
      "authority_boundary": "Candidate reusable engineering guidance; local tests and repo authority decide adoption."
    },
    {
      "offering_id": "dad:offering:agent-skill-library",
      "name": "Agent Skill Library",
      "version": "0.1.0",
      "offering_type": "skill",
      "path": "registry/agent-skill-library.json",
      "languages": ["agent-instruction", "python", "rust", "mixed"],
      "repo_types": ["application", "library", "template_repo", "control_plane"],
      "domains": ["ai_engineering", "agent_workflow"],
      "context_tags": ["agent_skill", "checkout", "lifecycle", "mail_center"],
      "task_types": ["skill_checkout", "agent_instruction_design", "repo_template_creation", "coding"],
      "capabilities": ["codex_skill_pointer", "claude_skill_pointer", "cursor_guidance", "skill_lifecycle_notice"],
      "applies_when": ["A repo needs to know which agent skills to use without copying full skill bodies."],
      "does_not_apply_when": ["A full skill install or plugin install is requested without explicit local approval."],
      "public_safe": true,
      "upgrade_channel": "dad_mail",
      "known_upgrades": [],
      "source_refs": ["docs/AGENT_SKILL_LIBRARY.md", "registry/agent-skill-library.json"],
      "review_status": "reviewed",
      "authority_boundary": "Skill records are pointers and lifecycle metadata; target repos decide checkout."
    },
    {
      "offering_id": "dad:offering:rust-shadow-parity-harness",
      "name": "Rust Shadow Parity Harness",
      "version": "0.1.0",
      "offering_type": "harness",
      "path": "assets/coding-harnesses/rust-shadow-parity-harness",
      "languages": ["python", "rust", "mixed"],
      "repo_types": ["application", "library", "test_suite"],
      "domains": ["software_engineering", "test_performance"],
      "context_tags": ["test_parity", "rust_shadow", "performance", "audit"],
      "task_types": ["testing", "test_performance", "rust_shadow_layer", "parity_review"],
      "capabilities": ["dual_path_comparison", "parity_audit", "timing_claim_gate"],
      "applies_when": ["A repo is considering Rust replacement or shadow tests for a slow Python test battery."],
      "does_not_apply_when": ["The Rust suite does not have structured coverage evidence matching Python tests."],
      "public_safe": true,
      "upgrade_channel": "dad_mail",
      "known_upgrades": [
        {
          "upgrade_id": "dad:upgrade:rust-shadow-parity-harness:0.1.0",
          "summary": "Initial candidate harness for Python/Rust test parity timing and audit.",
          "available_at": "assets/coding-harnesses/rust-shadow-parity-harness"
        }
      ],
      "source_refs": ["src/digital_asset_directory/test_parity.py", "docs/TESTING_AND_ORCHESTRATION.md"],
      "review_status": "candidate",
      "authority_boundary": "Rust timing claims are gated behind verified structured parity."
    },
    {
      "offering_id": "dad:offering:python-test-performance-harness",
      "name": "Python Test Performance And Orchestration Harness",
      "version": "0.1.0",
      "offering_type": "harness",
      "path": "assets/coding-harnesses/python-test-performance-orchestration",
      "languages": ["python"],
      "repo_types": ["application", "library", "test_suite"],
      "domains": ["software_engineering", "test_performance"],
      "context_tags": ["pytest", "test_selection", "orchestration", "performance"],
      "task_types": ["testing", "pytest", "test_performance", "ci_orchestration"],
      "capabilities": ["slow_test_inventory", "change_based_selection", "parallel_test_strategy"],
      "applies_when": ["A Python repo's full test battery is too slow or poorly targeted."],
      "does_not_apply_when": ["Skipping tests would hide coverage for a risky shared behavior change."],
      "public_safe": true,
      "upgrade_channel": "dad_mail",
      "known_upgrades": [],
      "source_refs": ["docs/TESTING_AND_ORCHESTRATION.md", "assets/python-ai-advantage-preflight"],
      "review_status": "candidate",
      "authority_boundary": "Test selection is a proposal; full validation remains required for risky changes."
    },
    {
      "offering_id": "dad:offering:repo-enrollment-mail-governance-safety-harness",
      "name": "Repo Enrollment Mail Governance Safety Harness",
      "version": "0.1.0",
      "offering_type": "harness",
      "path": "assets/coding-harnesses/repo-enrollment-mail-governance-safety",
      "languages": ["python", "agent-instruction"],
      "repo_types": ["control_plane", "governed_repo_family", "application"],
      "domains": ["governance", "mail_center"],
      "context_tags": ["repo_enrollment", "mail_center", "public_safe", "protected_repo"],
      "task_types": ["enrollment", "mail_delivery", "governance_review", "public_release"],
      "capabilities": ["protected_repo_gate", "mail_write_boundary_check", "public_release_gate"],
      "applies_when": ["DAD is planning or applying enrollment, mail delivery, or governance updates."],
      "does_not_apply_when": ["A repo is not in reviewed policy or lacks a human approval ID for broad writes."],
      "public_safe": true,
      "upgrade_channel": "dad_mail",
      "known_upgrades": [],
      "source_refs": ["docs/DAD_REPO_ENROLLMENT.md", "docs/MAIL_CENTER.md"],
      "review_status": "candidate",
      "authority_boundary": "Normal recurring DAD operation writes only mailbox files; broader changes require approval."
    }
  ]
}
